{
  "success": true,
  "unit": {
    "title": "CLOSING PROCEDURES — THEORY",
    "duration": "2-3 hours",
    "trainer": "Demetri",
    "location": "",
    "purpose": "",
    "contentSections": [
      {
        "heading": "DINING ROOM & FLOOR",
        "content": [
          {
            "type": "list",
            "items": [
              "Wipe all tables, counters, stools, sofas",
              "Inspect booths, vacuum/wipe as needed",
              "Chairs tucked and aligned",
              "Sweep under all tables, bar, expo",
              "Check corners and under banquettes",
              "Collect all trash, replace all liners",
              "Roll as many napkin sets as possible"
            ]
          }
        ]
      },
      {
        "heading": "EXPO & WATER STATION",
        "content": [
          {
            "type": "list",
            "items": [
              "Break down water station, clean, air dry",
              "Purge tickets, wipe printer/screen",
              "Stock backup printer paper",
              "Wipe cabinet doors",
              "Organize metal racks (guest visible)",
              "Remove debris under expo",
              "Refill sauce ramekins, date",
              "Refill spice shakers",
              "Label/date sauces, move to walk-in",
              "Stock to-go supplies to 100%",
              "Restock beverage fridge"
            ]
          }
        ]
      },
      {
        "heading": "TO-GO / HOST STAND",
        "content": [
          {
            "type": "list",
            "items": [
              "Wipe surfaces",
              "Clean kiosk (move to get under/behind)",
              "Organize drawers/cabinets",
              "Restock to-go supplies",
              "Notify manager if supplies low"
            ]
          }
        ]
      },
      {
        "heading": "CASHIER & RETAIL",
        "content": [
          {
            "type": "list",
            "items": [
              "Wipe counters and cabinet fronts",
              "Restock baklava generously",
              "Final guest-eye check"
            ]
          }
        ]
      },
      {
        "heading": "COFFEE/TEA & FROYO",
        "content": [
          {
            "type": "list",
            "items": [
              "Wipe all surfaces, move machines, clean under",
              "Clean Turkish coffee pitcher",
              "**Large froyo: STOP → FRESH mode**",
              "**Small froyo: OFF → WASH → OFF (standby)**"
            ]
          }
        ]
      },
      {
        "heading": "BATHROOMS",
        "content": [
          {
            "type": "list",
            "items": [
              "Windex mirrors",
              "Wipe sinks and fixtures spotless",
              "Stock 1 full pack paper towels minimum",
              "Replace TP if low",
              "Refill soap if below half",
              "Dust wall ledge"
            ]
          }
        ]
      },
      {
        "heading": "OFFICE",
        "content": [
          {
            "type": "list",
            "items": [
              "Sweep floors",
              "Remove food/drink containers",
              "Hang aprons neatly",
              "Empty desk trash"
            ]
          }
        ]
      },
      {
        "heading": "NOTES FOR OPENING TEAM",
        "content": [
          {
            "type": "paragraph",
            "content": "Write useful information for tomorrow."
          }
        ]
      },
      {
        "heading": "SIGNATURES",
        "content": [
          {
            "type": "paragraph",
            "content": "Both closers sign and date."
          },
          {
            "type": "paragraph",
            "content": "---"
          }
        ]
      }
    ],
    "activities": [],
    "fullMarkdown": "# UNIT 2.4: CLOSING PROCEDURES — THEORY\n\n**Duration:** 2-3 hours  \n**Trainer:** Demetri\n\n## The Philosophy of Closing\n\n\"Close like you're opening tomorrow. Because someone is.\"\n\n## CRITICAL RULE\n\n**DO NOT START CLOSING THE DINING ROOM BEFORE 9:45 PM**  \n**UNLESS GIVEN EXPLICIT PERMISSION BY MOD**\n\nWhy: Guests at 9:30 shouldn't feel rushed. Hospitality until close.\n\n## FOH Closing Checklist — Complete\n\n### DINING ROOM & FLOOR\n- Wipe all tables, counters, stools, sofas\n- Inspect booths, vacuum/wipe as needed\n- Chairs tucked and aligned\n- Sweep under all tables, bar, expo\n- Check corners and under banquettes\n- Collect all trash, replace all liners\n- Roll as many napkin sets as possible\n\n### EXPO & WATER STATION\n- Break down water station, clean, air dry\n- Purge tickets, wipe printer/screen\n- Stock backup printer paper\n- Wipe cabinet doors\n- Organize metal racks (guest visible)\n- Remove debris under expo\n- Refill sauce ramekins, date\n- Refill spice shakers\n- Label/date sauces, move to walk-in\n- Stock to-go supplies to 100%\n- Restock beverage fridge\n\n### TO-GO / HOST STAND\n- Wipe surfaces\n- Clean kiosk (move to get under/behind)\n- Organize drawers/cabinets\n- Restock to-go supplies\n- Notify manager if supplies low\n\n### CASHIER & RETAIL\n- Wipe counters and cabinet fronts\n- Restock baklava generously\n- Final guest-eye check\n\n### COFFEE/TEA & FROYO\n- Wipe all surfaces, move machines, clean under\n- Clean Turkish coffee pitcher\n- **Large froyo: STOP → FRESH mode**\n- **Small froyo: OFF → WASH → OFF (standby)**\n\n### BATHROOMS\n- Windex mirrors\n- Wipe sinks and fixtures spotless\n- Stock 1 full pack paper towels minimum\n- Replace TP if low\n- Refill soap if below half\n- Dust wall ledge\n\n### OFFICE\n- Sweep floors\n- Remove food/drink containers\n- Hang aprons neatly\n- Empty desk trash\n\n### NOTES FOR OPENING TEAM\nWrite useful information for tomorrow.\n\n### SIGNATURES\nBoth closers sign and date.\n\n---\n",
    "reflection": [
      "The 9:45 PM rule exists because",
      "The frozen yogurt machines have different shutdown procedures",
      "When leaving notes for the opening team, I should include",
      "The water station breakdown process is",
      "Both closers sign the checklist because",
      "Questions I have about closing procedures"
    ]
  }
}