{
  "success": true,
  "unit": {
    "title": "JUDGMENT & DECISION-MAKING",
    "duration": "2-3 hours",
    "trainer": "Demetri",
    "location": "Office",
    "purpose": "Define the boundaries of Heming's authority. What can she handle? What needs Demetri?",
    "contentSections": [
      {
        "heading": "The Autonomy Spectrum (30 min)",
        "content": [
          {
            "type": "heading",
            "content": "Full Autonomy (Handle Yourself)",
            "detail": ""
          },
          {
            "type": "list",
            "items": [
              "Guest recovery/comps up to $50",
              "Coaching conversations",
              "Schedule adjustments day-of (within coverage)",
              "Operational fixes and troubleshooting",
              "Sending someone home if clearly needed (sick, intoxicated, fighting)",
              "Normal complaint handling",
              "Catering inquiries (up to confirmation)"
            ]
          },
          {
            "type": "heading",
            "content": "Consult Demetri",
            "detail": ""
          },
          {
            "type": "list",
            "items": [
              "Comps over $50",
              "Disciplinary documentation (before issuing)",
              "Schedule changes beyond day-of",
              "Catering orders over $1000",
              "Equipment failures requiring vendor/repair",
              "Staffing issues beyond your shift",
              "Any situation you're unsure about"
            ]
          },
          {
            "type": "heading",
            "content": "Always Escalate Immediately",
            "detail": ""
          },
          {
            "type": "list",
            "items": [
              "Terminations (Demetri makes final call)",
              "Suspensions",
              "Any injury beyond minor first aid",
              "Threats or violence",
              "Legal concerns",
              "Media inquiries",
              "Anything involving alcohol/liability",
              "Health department visits"
            ]
          }
        ]
      },
      {
        "heading": "The \"Explain It to Demetri\" Test (20 min)",
        "content": [
          {
            "type": "heading",
            "content": "Before making a decision, ask",
            "detail": ""
          },
          {
            "type": "paragraph",
            "content": "\"If Demetri asked me why I did this, could I explain my reasoning clearly?\""
          },
          {
            "type": "paragraph",
            "content": "If YES → Proceed If MAYBE → Proceed cautiously, document well If NO → Ask first"
          },
          {
            "type": "heading",
            "content": "Examples",
            "detail": ""
          },
          {
            "type": "paragraph",
            "content": "Situation: Guest's food took 25 minutes, they're visibly frustrated. Your decision: Comp the meal. Can you explain it?: Yes—service recovery, guest was clearly unhappy, comping shows we care. → Proceed"
          },
          {
            "type": "paragraph",
            "content": "Situation: Employee asks to leave 2 hours early for \"personal reasons.\" Your decision: Let them go. Can you explain it?: Maybe—depends on coverage. If we're covered, probably fine. If we're short, risky. → Check coverage, make judgment call, document why."
          },
          {
            "type": "paragraph",
            "content": "Situation: Someone asks about writing a review for a news article. Your decision: Give interview. Can you explain it?: No—this could have implications you don't understand. → Escalate immediately."
          }
        ]
      },
      {
        "heading": "Scenario Practice (45 min)",
        "content": [
          {
            "type": "paragraph",
            "content": "Rapid-fire: 15 situations, Heming says \"my call\" or \"ask Demetri\""
          },
          {
            "type": "paragraph",
            "content": "1. Guest wants a refund for takeout from yesterday 2. Server asks to swap shifts with another server 3. Cook calls in sick 30 minutes before their shift 4. Guest claims they found a hair in food 5. Delivery driver is 20 minutes late 6. Team member asks for a raise 7. Guest wants to speak to the owner 8. Frozen yogurt machine stops working 9. Team member is on their phone in guest view 10. Guest slips and falls, says they're fine 11. Vendor shows up with wrong order 12. Team member is crying in the back 13. Guest is visibly intoxicated 14. Someone from the newspaper calls 15. Catering order of $2000 comes in"
          },
          {
            "type": "heading",
            "content": "Debrief",
            "detail": "Discuss the reasoning for each answer."
          }
        ]
      },
      {
        "heading": "Building Judgment Over Time (15 min)",
        "content": [
          {
            "type": "heading",
            "content": "How Good Judgment Develops",
            "detail": ""
          },
          {
            "type": "list",
            "items": [
              "Experience: You learn from situations",
              "Feedback: Demetri tells you when you got it right/wrong",
              "Pattern recognition: Similar situations = similar responses",
              "Reflection: Thinking about what worked"
            ]
          },
          {
            "type": "heading",
            "content": "Accelerating Learning",
            "detail": ""
          },
          {
            "type": "list",
            "items": [
              "When Demetri makes a decision, ask WHY",
              "After you make a call, evaluate the outcome",
              "Don't be afraid to ask—that's learning, not weakness",
              "Document your reasoning—review later"
            ]
          }
        ]
      }
    ],
    "activities": [
      {
        "title": "15 Scenarios (Verbal)",
        "content": [
          {
            "type": "paragraph",
            "content": "Rapid-fire exercise described above. Goal: Demonstrate judgment, explain reasoning."
          }
        ]
      },
      {
        "title": "Create Personal Escalation Guide",
        "content": [
          {
            "type": "paragraph",
            "content": "Document for quick reference:"
          },
          {
            "type": "list",
            "items": [
              "Situations I handle",
              "Situations I escalate",
              "Emergency contacts",
              "Key thresholds ($50 comp, $1000 catering, etc.)"
            ]
          }
        ]
      }
    ],
    "fullMarkdown": "# UNIT 5.5: JUDGMENT & DECISION-MAKING\n\n**Duration:** 2-3 hours  \n**Trainer:** Demetri  \n**Location:** Office\n\n## Purpose\n\nDefine the boundaries of Heming's authority. What can she handle? What needs Demetri?\n\n## Content to Cover\n\n### The Autonomy Spectrum (30 min)\n\n**Full Autonomy (Handle Yourself):**\n- Guest recovery/comps up to $50\n- Coaching conversations\n- Schedule adjustments day-of (within coverage)\n- Operational fixes and troubleshooting\n- Sending someone home if clearly needed (sick, intoxicated, fighting)\n- Normal complaint handling\n- Catering inquiries (up to confirmation)\n\n**Consult Demetri:**\n- Comps over $50\n- Disciplinary documentation (before issuing)\n- Schedule changes beyond day-of\n- Catering orders over $1000\n- Equipment failures requiring vendor/repair\n- Staffing issues beyond your shift\n- Any situation you're unsure about\n\n**Always Escalate Immediately:**\n- Terminations (Demetri makes final call)\n- Suspensions\n- Any injury beyond minor first aid\n- Threats or violence\n- Legal concerns\n- Media inquiries\n- Anything involving alcohol/liability\n- Health department visits\n\n### The \"Explain It to Demetri\" Test (20 min)\n\n**Before making a decision, ask:**\n\"If Demetri asked me why I did this, could I explain my reasoning clearly?\"\n\nIf YES → Proceed\nIf MAYBE → Proceed cautiously, document well\nIf NO → Ask first\n\n**Examples:**\n\nSituation: Guest's food took 25 minutes, they're visibly frustrated.\nYour decision: Comp the meal.\nCan you explain it?: Yes—service recovery, guest was clearly unhappy, comping shows we care.\n→ Proceed\n\nSituation: Employee asks to leave 2 hours early for \"personal reasons.\"\nYour decision: Let them go.\nCan you explain it?: Maybe—depends on coverage. If we're covered, probably fine. If we're short, risky.\n→ Check coverage, make judgment call, document why.\n\nSituation: Someone asks about writing a review for a news article.\nYour decision: Give interview.\nCan you explain it?: No—this could have implications you don't understand.\n→ Escalate immediately.\n\n### Scenario Practice (45 min)\n\nRapid-fire: 15 situations, Heming says \"my call\" or \"ask Demetri\"\n\n1. Guest wants a refund for takeout from yesterday\n2. Server asks to swap shifts with another server\n3. Cook calls in sick 30 minutes before their shift\n4. Guest claims they found a hair in food\n5. Delivery driver is 20 minutes late\n6. Team member asks for a raise\n7. Guest wants to speak to the owner\n8. Frozen yogurt machine stops working\n9. Team member is on their phone in guest view\n10. Guest slips and falls, says they're fine\n11. Vendor shows up with wrong order\n12. Team member is crying in the back\n13. Guest is visibly intoxicated\n14. Someone from the newspaper calls\n15. Catering order of $2000 comes in\n\n**Debrief:** Discuss the reasoning for each answer.\n\n### Building Judgment Over Time (15 min)\n\n**How Good Judgment Develops:**\n- Experience: You learn from situations\n- Feedback: Demetri tells you when you got it right/wrong\n- Pattern recognition: Similar situations = similar responses\n- Reflection: Thinking about what worked\n\n**Accelerating Learning:**\n- When Demetri makes a decision, ask WHY\n- After you make a call, evaluate the outcome\n- Don't be afraid to ask—that's learning, not weakness\n- Document your reasoning—review later\n\n## Hands-On Activities\n\n### Activity 1: 15 Scenarios (Verbal)\n\nRapid-fire exercise described above.\nGoal: Demonstrate judgment, explain reasoning.\n\n### Activity 2: Create Personal Escalation Guide\n\nDocument for quick reference:\n- Situations I handle\n- Situations I escalate\n- Emergency contacts\n- Key thresholds ($50 comp, $1000 catering, etc.)\n\n## Reflection Questions\n\n1. Decisions I can make independently include...\n2. I should always escalate when...\n3. The test I use to decide is...\n4. One area where I'm not sure about my authority is...\n5. Good judgment develops through...\n\n---\n",
    "reflection": [
      "Decisions I can make independently include",
      "I should always escalate when",
      "The test I use to decide is"
    ]
  }
}