{
  "success": true,
  "unit": {
    "title": "OPENING PROCEDURES — PRACTICE",
    "duration": "4-6 hours (2-3 opening shifts)",
    "trainer": "Demetri (observing)",
    "location": "",
    "purpose": "",
    "contentSections": [
      {
        "heading": "Shift 1: Shadow an Experienced Opener",
        "content": [
          {
            "type": "list",
            "items": [
              "Observe everything, ask questions, take notes",
              "Don't do tasks—watch and learn",
              "Focus: sequence, timing, techniques"
            ]
          }
        ]
      },
      {
        "heading": "Shift 2: Execute with Supervision",
        "content": [
          {
            "type": "list",
            "items": [
              "Heming does the work with trainer present",
              "Can ask questions as needed",
              "Uses checklist actively"
            ]
          }
        ]
      },
      {
        "heading": "Shift 3: Execute with Minimal Guidance",
        "content": [
          {
            "type": "list",
            "items": [
              "Heming opens independently",
              "Demetri arrives at 10:45 AM to inspect",
              "Completes closer rating",
              "Ready to open doors on time"
            ]
          }
        ]
      }
    ],
    "activities": [],
    "fullMarkdown": "# UNIT 2.2: OPENING PROCEDURES — PRACTICE\n\n**Duration:** 4-6 hours (2-3 opening shifts)  \n**Trainer:** Demetri (observing)\n\n## Structure\n\n### Shift 1: Shadow an Experienced Opener\n- Observe everything, ask questions, take notes\n- Don't do tasks—watch and learn\n- Focus: sequence, timing, techniques\n\n### Shift 2: Execute with Supervision\n- Heming does the work with trainer present\n- Can ask questions as needed\n- Uses checklist actively\n\n### Shift 3: Execute with Minimal Guidance\n- Heming opens independently\n- Demetri arrives at 10:45 AM to inspect\n- Completes closer rating\n- Ready to open doors on time\n\n## Evaluation Criteria\n- [ ] All checklist items completed\n- [ ] Doors open on time\n- [ ] Restaurant is guest-ready\n- [ ] Rating of previous closer is fair and specific\n\n---\n",
    "reflection": [
      "The opening task I found most challenging was _____________ because",
      "One thing I would add to the opening checklist is",
      "My rating of yesterday's closing crew was _____/5 because",
      "Three things the closer missed that I corrected",
      "My total opening time was _______ minutes. To improve, I will",
      "The sequence I found most efficient was"
    ]
  }
}