{
  "success": true,
  "unit": {
    "title": "HR ONBOARDING & COMPLIANCE",
    "duration": "2-3 hours",
    "trainer": "Demetri",
    "location": "Office",
    "purpose": "Complete all required employment paperwork and ensure Heming understands key policies. This is administrative but important—done well, it protects both Heming and Jayna. Done poorly, it creates liability and confusion.",
    "contentSections": [
      {
        "heading": "Required Paperwork (45-60 min)",
        "content": [
          {
            "type": "paragraph",
            "content": "Work through each form together. Don't just hand her a stack—explain what each document is for."
          },
          {
            "type": "heading",
            "content": "I-9 (Employment Eligibility Verification)",
            "detail": ""
          },
          {
            "type": "list",
            "items": [
              "Explain what it verifies and why it's required",
              "Complete Section 1 together",
              "Review acceptable documents for Section 2",
              "Must be completed within 3 days of start date"
            ]
          },
          {
            "type": "heading",
            "content": "W-4 (Federal Tax Withholding)",
            "detail": ""
          },
          {
            "type": "list",
            "items": [
              "Explain how it affects her paycheck",
              "She can adjust this anytime if her situation changes",
              "Don't give tax advice—just explain the form"
            ]
          },
          {
            "type": "heading",
            "content": "Direct Deposit Authorization",
            "detail": ""
          },
          {
            "type": "list",
            "items": [
              "Get banking information",
              "Explain pay schedule and when first check will come",
              "Answer questions about payroll"
            ]
          },
          {
            "type": "heading",
            "content": "Emergency Contact Information",
            "detail": ""
          },
          {
            "type": "list",
            "items": [
              "Who to call if something happens",
              "Medical conditions we should know about (optional but helpful)"
            ]
          },
          {
            "type": "heading",
            "content": "Meal Break Waiver (if applicable)",
            "detail": ""
          },
          {
            "type": "list",
            "items": [
              "Explain California meal break requirements",
              "If she wants to waive (work through meal on short shifts), this documents that choice",
              "Emphasize this is HER choice, not required",
              "Can be revoked anytime in writing"
            ]
          },
          {
            "type": "heading",
            "content": "Handbook Acknowledgment",
            "detail": ""
          },
          {
            "type": "list",
            "items": [
              "She's signing that she received and will read the handbook",
              "Not signing that she memorizes every word",
              "Key sections will be reviewed together (next section)"
            ]
          }
        ]
      },
      {
        "heading": "Employee Handbook Review (45-60 min)",
        "content": [
          {
            "type": "paragraph",
            "content": "Don't read the whole handbook aloud—focus on the sections that matter most for a new Assistant Manager."
          },
          {
            "type": "heading",
            "content": "At-Will Employment (Critical)",
            "detail": ""
          },
          {
            "type": "list",
            "items": [
              "\"This means either you or Jayna can end employment at any time, for any legal reason or no reason.\"",
              "\"It doesn't mean we fire people casually—it means we don't have contracts that lock either party in.\"",
              "\"As a manager, you need to understand this because you'll be involved in employment decisions.\""
            ]
          },
          {
            "type": "heading",
            "content": "Harassment Policy and Reporting",
            "detail": ""
          },
          {
            "type": "list",
            "items": [
              "Zero tolerance explained",
              "What constitutes harassment (sexual, discriminatory, bullying)",
              "How to report—including if the harasser is a manager",
              "Her responsibility as a manager to report what she sees/hears",
              "Retaliation is prohibited"
            ]
          },
          {
            "type": "heading",
            "content": "Attendance and Tardiness",
            "detail": ""
          },
          {
            "type": "list",
            "items": [
              "Expectations for her role",
              "How to communicate if she'll be late or absent",
              "Her responsibility to enforce these standards with the team"
            ]
          },
          {
            "type": "heading",
            "content": "Personal Appearance and Hygiene",
            "detail": ""
          },
          {
            "type": "list",
            "items": [
              "Dress code expectations",
              "Food service hygiene requirements",
              "Leading by example"
            ]
          },
          {
            "type": "heading",
            "content": "Cell Phone Policy",
            "detail": ""
          },
          {
            "type": "list",
            "items": [
              "Not visible to guests",
              "Reasonable personal use, determined by management",
              "As a manager, she can use her phone for work purposes but should model good behavior"
            ]
          },
          {
            "type": "heading",
            "content": "Confidentiality",
            "detail": ""
          },
          {
            "type": "list",
            "items": [
              "What information is confidential (financial, personnel, recipes)",
              "Not sharing on social media",
              "Protecting guest information"
            ]
          },
          {
            "type": "heading",
            "content": "Corrective Action / Progressive Discipline",
            "detail": ""
          },
          {
            "type": "list",
            "items": [
              "Overview of how discipline works",
              "She'll learn more about this in Module 5",
              "For now, just understand it exists and is applied fairly"
            ]
          }
        ]
      },
      {
        "heading": "Homebase Setup (15-20 min)",
        "content": [
          {
            "type": "paragraph",
            "content": "Get her into the communication system immediately."
          },
          {
            "type": "heading",
            "content": "Account Creation",
            "detail": ""
          },
          {
            "type": "list",
            "items": [
              "Create her Homebase profile",
              "Set up the app on her phone",
              "Add her to appropriate groups"
            ]
          },
          {
            "type": "heading",
            "content": "Expectations for Communication",
            "detail": ""
          },
          {
            "type": "list",
            "items": [
              "Check Homebase at least [X times per day]",
              "Respond to messages within [X hours]",
              "How to request time off",
              "How to swap shifts (once she's on the schedule)"
            ]
          },
          {
            "type": "heading",
            "content": "Practice",
            "detail": ""
          },
          {
            "type": "list",
            "items": [
              "Send her a test message",
              "Have her respond",
              "Show her where to find the schedule"
            ]
          }
        ]
      },
      {
        "heading": "Schedule Discussion (15 min)",
        "content": [
          {
            "type": "paragraph",
            "content": "Set expectations for her schedule during training and beyond."
          },
          {
            "type": "heading",
            "content": "Training Period",
            "detail": ""
          },
          {
            "type": "list",
            "items": [
              "Flexible to accommodate training needs",
              "Mixture of shifts to see all dayparts",
              "Goal is exposure to everything, not just one shift type"
            ]
          },
          {
            "type": "heading",
            "content": "Post-Training",
            "detail": ""
          },
          {
            "type": "list",
            "items": [
              "Expected hours per week",
              "Typical shifts for Assistant Manager",
              "Weekend/holiday expectations",
              "How scheduling will work with Demetri"
            ]
          },
          {
            "type": "heading",
            "content": "Availability",
            "detail": ""
          },
          {
            "type": "list",
            "items": [
              "Get her general availability",
              "Discuss any constraints (school, family, other commitments)",
              "Be clear about flexibility requirements for the role"
            ]
          }
        ]
      }
    ],
    "activities": [
      {
        "title": "Homebase Practice (10 min)",
        "content": [
          {
            "type": "list",
            "items": [
              "Clock in and clock out (practice)",
              "Navigate to the schedule",
              "Find team member contact info",
              "Send a message to Demetri"
            ]
          }
        ]
      },
      {
        "title": "Policy Scenarios (15 min)",
        "content": [
          {
            "type": "paragraph",
            "content": "Quick verbal quiz to confirm understanding:"
          },
          {
            "type": "paragraph",
            "content": "1. \"A team member tells you another employee made an inappropriate comment to them. What do you do?\" 2. \"You're running 10 minutes late for your shift. What do you do?\" 3. \"A friend asks you how much money Jayna makes on a busy Saturday. What do you say?\" 4. \"You see an employee on their phone in guest view. What do you do?\""
          },
          {
            "type": "heading",
            "content": "Debrief",
            "detail": ""
          },
          {
            "type": "paragraph",
            "content": "Discuss answers. There are right answers here—make sure she knows them."
          }
        ]
      }
    ],
    "fullMarkdown": "# UNIT 1.2: HR ONBOARDING & COMPLIANCE\n\n**Duration:** 2-3 hours  \n**Trainer:** Demetri  \n**Location:** Office\n\n## Purpose\n\nComplete all required employment paperwork and ensure Heming understands key policies. This is administrative but important—done well, it protects both Heming and Jayna. Done poorly, it creates liability and confusion.\n\n## Content to Cover\n\n### Required Paperwork (45-60 min)\n\nWork through each form together. Don't just hand her a stack—explain what each document is for.\n\n**I-9 (Employment Eligibility Verification):**\n- Explain what it verifies and why it's required\n- Complete Section 1 together\n- Review acceptable documents for Section 2\n- Must be completed within 3 days of start date\n\n**W-4 (Federal Tax Withholding):**\n- Explain how it affects her paycheck\n- She can adjust this anytime if her situation changes\n- Don't give tax advice—just explain the form\n\n**Direct Deposit Authorization:**\n- Get banking information\n- Explain pay schedule and when first check will come\n- Answer questions about payroll\n\n**Emergency Contact Information:**\n- Who to call if something happens\n- Medical conditions we should know about (optional but helpful)\n\n**Meal Break Waiver (if applicable):**\n- Explain California meal break requirements\n- If she wants to waive (work through meal on short shifts), this documents that choice\n- Emphasize this is HER choice, not required\n- Can be revoked anytime in writing\n\n**Handbook Acknowledgment:**\n- She's signing that she received and will read the handbook\n- Not signing that she memorizes every word\n- Key sections will be reviewed together (next section)\n\n### Employee Handbook Review (45-60 min)\n\nDon't read the whole handbook aloud—focus on the sections that matter most for a new Assistant Manager.\n\n**At-Will Employment (Critical):**\n- \"This means either you or Jayna can end employment at any time, for any legal reason or no reason.\"\n- \"It doesn't mean we fire people casually—it means we don't have contracts that lock either party in.\"\n- \"As a manager, you need to understand this because you'll be involved in employment decisions.\"\n\n**Harassment Policy and Reporting:**\n- Zero tolerance explained\n- What constitutes harassment (sexual, discriminatory, bullying)\n- How to report—including if the harasser is a manager\n- Her responsibility as a manager to report what she sees/hears\n- Retaliation is prohibited\n\n**Attendance and Tardiness:**\n- Expectations for her role\n- How to communicate if she'll be late or absent\n- Her responsibility to enforce these standards with the team\n\n**Personal Appearance and Hygiene:**\n- Dress code expectations\n- Food service hygiene requirements\n- Leading by example\n\n**Cell Phone Policy:**\n- Not visible to guests\n- Reasonable personal use, determined by management\n- As a manager, she can use her phone for work purposes but should model good behavior\n\n**Confidentiality:**\n- What information is confidential (financial, personnel, recipes)\n- Not sharing on social media\n- Protecting guest information\n\n**Corrective Action / Progressive Discipline:**\n- Overview of how discipline works\n- She'll learn more about this in Module 5\n- For now, just understand it exists and is applied fairly\n\n### Homebase Setup (15-20 min)\n\nGet her into the communication system immediately.\n\n**Account Creation:**\n- Create her Homebase profile\n- Set up the app on her phone\n- Add her to appropriate groups\n\n**Expectations for Communication:**\n- Check Homebase at least [X times per day]\n- Respond to messages within [X hours]\n- How to request time off\n- How to swap shifts (once she's on the schedule)\n\n**Practice:**\n- Send her a test message\n- Have her respond\n- Show her where to find the schedule\n\n### Schedule Discussion (15 min)\n\nSet expectations for her schedule during training and beyond.\n\n**Training Period:**\n- Flexible to accommodate training needs\n- Mixture of shifts to see all dayparts\n- Goal is exposure to everything, not just one shift type\n\n**Post-Training:**\n- Expected hours per week\n- Typical shifts for Assistant Manager\n- Weekend/holiday expectations\n- How scheduling will work with Demetri\n\n**Availability:**\n- Get her general availability\n- Discuss any constraints (school, family, other commitments)\n- Be clear about flexibility requirements for the role\n\n## Hands-On Activities\n\n### Activity 1: Homebase Practice (10 min)\n- Clock in and clock out (practice)\n- Navigate to the schedule\n- Find team member contact info\n- Send a message to Demetri\n\n### Activity 2: Policy Scenarios (15 min)\n\nQuick verbal quiz to confirm understanding:\n\n1. \"A team member tells you another employee made an inappropriate comment to them. What do you do?\"\n2. \"You're running 10 minutes late for your shift. What do you do?\"\n3. \"A friend asks you how much money Jayna makes on a busy Saturday. What do you say?\"\n4. \"You see an employee on their phone in guest view. What do you do?\"\n\n**Debrief:**\nDiscuss answers. There are right answers here—make sure she knows them.\n\n## Trainer Notes\n\n**Tone for This Unit:**\nProfessional but not cold. This is necessary paperwork, but it's also setting up her success. Frame it as \"protecting both of us\" rather than \"rules you have to follow.\"\n\n**Common Pitfalls:**\n- Rushing through paperwork without explaining it\n- Skipping the handbook review because \"she can read it later\"\n- Not actually setting up Homebase and practicing it\n- Forgetting to discuss schedule expectations\n\n**End This Unit With:**\n\"I know paperwork isn't exciting, but it's the foundation that lets everything else work. You're officially part of the team now—let's go meet everyone properly.\"\n\n---\n",
    "reflection": [
      "Three policies from the Employee Handbook I want to make sure I understand correctly",
      "My understanding of at-will employment is",
      "If I witness or learn about harassment in the workplace, I will",
      "The expectations for checking and responding to Homebase messages are",
      "If I'm going to be late for my shift, I should",
      "As a manager, my cell phone policy responsibility is",
      "Information that is confidential and should not be shared includes",
      "Questions I still have about policies or procedures"
    ]
  }
}