{
  "success": true,
  "unit": {
    "title": "COCKTAIL THEORY & TECHNIQUE",
    "duration": "3-4 hours | **Trainer:** Kayla",
    "trainer": "Kayla",
    "location": "",
    "purpose": "",
    "contentSections": [
      {
        "heading": "SHAKING",
        "content": [
          {
            "type": "list",
            "items": [
              "When: Citrus, dairy, eggs",
              "How: Ice-filled tin, shake hard 10-15 seconds",
              "Goal: Chill, dilute, integrate"
            ]
          }
        ]
      },
      {
        "heading": "STIRRING",
        "content": [
          {
            "type": "list",
            "items": [
              "When: Spirit-forward, no citrus",
              "How: Mixing glass, bar spoon, 30-45 seconds",
              "Goal: Chill, dilute, keep silky"
            ]
          }
        ]
      },
      {
        "heading": "MUDDLING",
        "content": [
          {
            "type": "list",
            "items": [
              "Herbs: Gentle press—release oils, don't shred",
              "Fruit: Firmer—extract juice"
            ]
          }
        ]
      },
      {
        "heading": "DRY SHAKE",
        "content": [
          {
            "type": "list",
            "items": [
              "When: Egg white or foamer",
              "How: Shake WITHOUT ice first (emulsify), then add ice"
            ]
          }
        ]
      },
      {
        "heading": "STRAINING",
        "content": [
          {
            "type": "list",
            "items": [
              "Hawthorne: Spring-loaded, fits shaker",
              "Fine mesh: Double-strain for no ice chips"
            ]
          }
        ]
      }
    ],
    "activities": [],
    "fullMarkdown": "# UNIT 4.3: COCKTAIL THEORY & TECHNIQUE\n\n**Duration:** 3-4 hours | **Trainer:** Kayla\n\n## Cocktail Families\n\n**SOURS** (Spirit + Citrus + Sweet)\n- Formula: 2 oz spirit + 1 oz citrus + ¾ oz sweet\n- Technique: SHAKE (citrus = shake)\n\n**SPIRIT-FORWARD** (Spirit + Modifier)\n- Formula: 2 oz spirit + ½-1 oz modifier\n- Technique: STIR (no citrus = stir)\n\n**HIGHBALLS** (Spirit + Mixer)\n- Formula: 1.5-2 oz spirit + 4-6 oz mixer\n- Technique: BUILD in glass\n\n## Technique Fundamentals\n\n### SHAKING\n- When: Citrus, dairy, eggs\n- How: Ice-filled tin, shake hard 10-15 seconds\n- Goal: Chill, dilute, integrate\n\n### STIRRING\n- When: Spirit-forward, no citrus\n- How: Mixing glass, bar spoon, 30-45 seconds\n- Goal: Chill, dilute, keep silky\n\n### MUDDLING\n- Herbs: Gentle press—release oils, don't shred\n- Fruit: Firmer—extract juice\n\n### DRY SHAKE\n- When: Egg white or foamer\n- How: Shake WITHOUT ice first (emulsify), then add ice\n\n### STRAINING\n- Hawthorne: Spring-loaded, fits shaker\n- Fine mesh: Double-strain for no ice chips\n\n## Glassware\n- Coupe: Shaken cocktails, up drinks\n- Rocks: Spirit-forward on ice\n- Highball: Tall drinks with mixer\n- Clay pot: Yamas! (our signature)\n\n## Mise en Place\nBefore service: Ice full, juices checked, batch cocktails ready, garnishes prepped, tools positioned\n\n---\n",
    "reflection": [
      "You SHAKE a cocktail when",
      "You STIR a cocktail when",
      "A dry shake is used for _____________ and the technique is",
      "The purpose of garnish is",
      "The three parts of a \"sour\" cocktail are",
      "My mise en place checklist before service includes",
      "The technique I need to practice more is"
    ]
  }
}