{
  "success": true,
  "unit": {
    "title": "COMPLAINT HANDLING — PRACTICE",
    "duration": "4-6 hours (across multiple shifts)",
    "trainer": "Demetri (observing)",
    "location": "Floor during service",
    "purpose": "Theory becomes instinct through practice. This unit provides real-world experience with complaint handling while Demetri observes and coaches.",
    "contentSections": [
      {
        "heading": "Real Situation Handling",
        "content": [
          {
            "type": "paragraph",
            "content": "Over multiple shifts, Heming handles real guest complaints as they arise."
          },
          {
            "type": "heading",
            "content": "Demetri's Role",
            "detail": ""
          },
          {
            "type": "list",
            "items": [
              "Stay visible but not intrusive",
              "Let Heming take the lead",
              "Intervene only if situation escalates",
              "Debrief after each interaction"
            ]
          },
          {
            "type": "heading",
            "content": "Heming's Role",
            "detail": ""
          },
          {
            "type": "list",
            "items": [
              "Take ownership of complaints in her section",
              "Apply the 4-step process",
              "Make comp decisions within authority",
              "Escalate when appropriate"
            ]
          }
        ]
      },
      {
        "heading": "After Each Complaint",
        "content": [
          {
            "type": "paragraph",
            "content": "Quick debrief (2-5 min):"
          },
          {
            "type": "list",
            "items": [
              "What happened?",
              "What did you say first?",
              "How did the guest respond?",
              "What would you do differently?",
              "What went well?"
            ]
          }
        ]
      },
      {
        "heading": "Goals for This Unit",
        "content": [
          {
            "type": "paragraph",
            "content": "Heming should handle at least:"
          },
          {
            "type": "list",
            "items": [
              "[ ] 3 food-related complaints (wrong item, cold, missing)",
              "[ ] 1 wait time complaint",
              "[ ] 1 comp decision made independently",
              "[ ] 1 escalation to Demetri (even if manufactured)"
            ]
          }
        ]
      }
    ],
    "activities": [
      {
        "title": "Handle Real Complaints (Ongoing)",
        "content": [
          {
            "type": "paragraph",
            "content": "This unit IS the activity. Document each complaint handled:"
          },
          {
            "type": "paragraph",
            "content": "| Date | Complaint | My Response | Outcome | What I Learned | |------|-----------|-------------|---------|----------------| | | | | | | | | | | | | | | | | | |"
          }
        ]
      },
      {
        "title": "Independent Comp Decision",
        "content": [
          {
            "type": "paragraph",
            "content": "Make at least one comp decision without asking Demetri:"
          },
          {
            "type": "list",
            "items": [
              "What was the situation?",
              "What did you comp?",
              "Why was this the right call?",
              "Guest reaction?"
            ]
          }
        ]
      },
      {
        "title": "Escalation Practice",
        "content": [
          {
            "type": "paragraph",
            "content": "Even if no situation requires it, practice escalating:"
          },
          {
            "type": "list",
            "items": [
              "Identify a hypothetical situation that would need Demetri",
              "Practice the handoff: \"Let me get my manager—she'll make sure this is handled perfectly\"",
              "Debrief the handoff"
            ]
          }
        ]
      }
    ],
    "fullMarkdown": "# UNIT 3.4: COMPLAINT HANDLING — PRACTICE\n\n**Duration:** 4-6 hours (across multiple shifts)  \n**Trainer:** Demetri (observing)  \n**Location:** Floor during service\n\n## Purpose\n\nTheory becomes instinct through practice. This unit provides real-world experience with complaint handling while Demetri observes and coaches.\n\n## Structure\n\n### Real Situation Handling\n\nOver multiple shifts, Heming handles real guest complaints as they arise.\n\n**Demetri's Role:**\n- Stay visible but not intrusive\n- Let Heming take the lead\n- Intervene only if situation escalates\n- Debrief after each interaction\n\n**Heming's Role:**\n- Take ownership of complaints in her section\n- Apply the 4-step process\n- Make comp decisions within authority\n- Escalate when appropriate\n\n### After Each Complaint\n\nQuick debrief (2-5 min):\n- What happened?\n- What did you say first?\n- How did the guest respond?\n- What would you do differently?\n- What went well?\n\n### Goals for This Unit\n\nHeming should handle at least:\n- [ ] 3 food-related complaints (wrong item, cold, missing)\n- [ ] 1 wait time complaint\n- [ ] 1 comp decision made independently\n- [ ] 1 escalation to Demetri (even if manufactured)\n\n## Coaching Points\n\n**Common Mistakes to Watch For:**\n- Explaining or defending before apologizing\n- Checking ticket before taking action\n- Asking guest to prove their order\n- Offering fix without warmth\n- Not following up after fix\n\n**Signs of Progress:**\n- Immediate ownership language\n- Physical movement toward solution (not standing and explaining)\n- Genuine empathy (not scripted)\n- Appropriate comp without prompting\n- Follow-up check\n\n## Hands-On Activities\n\n### Activity 1: Handle Real Complaints (Ongoing)\n\nThis unit IS the activity. Document each complaint handled:\n\n| Date | Complaint | My Response | Outcome | What I Learned |\n|------|-----------|-------------|---------|----------------|\n| | | | | |\n| | | | | |\n| | | | | |\n\n### Activity 2: Independent Comp Decision\n\nMake at least one comp decision without asking Demetri:\n- What was the situation?\n- What did you comp?\n- Why was this the right call?\n- Guest reaction?\n\n### Activity 3: Escalation Practice\n\nEven if no situation requires it, practice escalating:\n- Identify a hypothetical situation that would need Demetri\n- Practice the handoff: \"Let me get my manager—she'll make sure this is handled perfectly\"\n- Debrief the handoff\n\n## Reflection Questions\n\n1. Today I handled a complaint about ___. I said ___ and did ___. The result was ___.\n2. One thing I would do differently next time is...\n3. I escalated to Demetri when ___ because...\n4. The comp decision I made independently was ___ because...\n5. The guest feedback that felt most genuine was when I...\n\n---\n",
    "reflection": [
      "The complaint that challenged me most was _____________ because",
      "One thing I would do differently in a past situation",
      "The comp decision I made independently",
      "If I had to escalate to Demetri, it was because"
    ]
  }
}