{
  "success": true,
  "unit": {
    "title": "TRANSITION PROCEDURES",
    "duration": "3-4 hours",
    "trainer": "Demetri",
    "location": "",
    "purpose": "",
    "contentSections": [
      {
        "heading": "RETAIL & DISPLAY",
        "content": [
          {
            "type": "list",
            "items": [
              "3-piece baklava boxes (more pistachio/walnut)",
              "Turkish delight case cleaned, restocked",
              "Cut and arrange Turkish delights"
            ]
          }
        ]
      },
      {
        "heading": "STOCKING & UTENSILS",
        "content": [
          {
            "type": "list",
            "items": [
              "Refill to-go sauces, bring full bottles",
              "Stock to-go boxes, lids, bags, silverware",
              "Bring out plates, bowls, silverware, ramekins",
              "Roll all clean silverware",
              "Ensure clean glasses available",
              "Fresh expo rag, discard used"
            ]
          }
        ]
      },
      {
        "heading": "DINING ROOM & STATIONS",
        "content": [
          {
            "type": "list",
            "items": [
              "Wipe tables, tuck chairs, wipe POS/host stand",
              "Refresh sanitation tubs and rags",
              "Stock water station supplies, empty trash",
              "Refill water jugs (ice first)",
              "Check froyo toppings, clean bottles",
              "Clear staff food area"
            ]
          }
        ]
      },
      {
        "heading": "BATHROOMS",
        "content": [
          {
            "type": "list",
            "items": [
              "Wipe sinks, mirrors, reset",
              "Toilet: top to bottom, ground around",
              "Refill towels, TP, soap",
              "Empty trash"
            ]
          }
        ]
      },
      {
        "heading": "BEVERAGES & PREP",
        "content": [
          {
            "type": "list",
            "items": [
              "Restock drinks fridge",
              "Prep bar fruit (lots of lemon wheels)",
              "Top off sangria, lemonade, ayran (or note)",
              "Wipe menus and table numbers"
            ]
          }
        ]
      },
      {
        "heading": "NOTES FOR CLOSING CREW",
        "content": [
          {
            "type": "paragraph",
            "content": "Write USEFUL notes:"
          },
          {
            "type": "list",
            "items": [
              "\"86'd hummus at 2 PM—kitchen prepping\"",
              "\"Table 4 complaint—comp'd dessert\"",
              "\"Sangria backup not prepped\""
            ]
          }
        ]
      }
    ],
    "activities": [],
    "fullMarkdown": "# UNIT 2.3: TRANSITION PROCEDURES\n\n**Duration:** 3-4 hours  \n**Trainer:** Demetri\n\n## The Philosophy of Transition\n\n\"Transition is passing the baton. Drop it, and the next runner stumbles.\"\n\n**The Standard:**\n- Closer walks into guest-ready restaurant\n- No scrambling for supplies\n- Communication happens—no surprises\n\n**Timing:**\n- Can start 1 hour before shift ends\n- BUT: Guests ALWAYS come before sidework\n\n## FOH Transition Checklist — Complete\n\n### RETAIL & DISPLAY\n- 3-piece baklava boxes (more pistachio/walnut)\n- Turkish delight case cleaned, restocked\n- Cut and arrange Turkish delights\n\n### STOCKING & UTENSILS\n- Refill to-go sauces, bring full bottles\n- Stock to-go boxes, lids, bags, silverware\n- Bring out plates, bowls, silverware, ramekins\n- Roll all clean silverware\n- Ensure clean glasses available\n- Fresh expo rag, discard used\n\n### DINING ROOM & STATIONS\n- Wipe tables, tuck chairs, wipe POS/host stand\n- Refresh sanitation tubs and rags\n- Stock water station supplies, empty trash\n- Refill water jugs (ice first)\n- Check froyo toppings, clean bottles\n- Clear staff food area\n\n### BATHROOMS\n- Wipe sinks, mirrors, reset\n- Toilet: top to bottom, ground around\n- Refill towels, TP, soap\n- Empty trash\n\n### BEVERAGES & PREP\n- Restock drinks fridge\n- Prep bar fruit (lots of lemon wheels)\n- Top off sangria, lemonade, ayran (or note)\n- Wipe menus and table numbers\n\n### NOTES FOR CLOSING CREW\nWrite USEFUL notes:\n- \"86'd hummus at 2 PM—kitchen prepping\"\n- \"Table 4 complaint—comp'd dessert\"\n- \"Sangria backup not prepped\"\n\n## The Team Check-In\n\n**15 minutes before leaving:**\n- Check with each BOH station\n- Check with FOH teammates\n- Full debrief with MOD\n\n**Questions:** \"Anything you need?\" \"Anything running low?\"\n\n---\n",
    "reflection": [
      "The transition is critical because",
      "FIFO means _____________ and it matters because",
      "The three questions I should ask before leaving my shift are",
      "One thing I noticed the PM crew needed that wasn't on the checklist",
      "The rule about guests coming before sidework means",
      "An example of a USEFUL note for the closing crew",
      "An example of a USELESS note (what NOT to write)"
    ]
  }
}