{
  "success": true,
  "unit": {
    "title": "THE PSYCHOLOGY OF HOSPITALITY",
    "duration": "2-3 hours",
    "trainer": "Demetri",
    "location": "Dining room + office discussion",
    "purpose": "Before learning techniques, Heming must understand the psychology of WHY hospitality works. This is the foundation that makes everything else meaningful.",
    "contentSections": [
      {
        "heading": "What Guests Really Want (30 min)",
        "content": [
          {
            "type": "paragraph",
            "content": "Beyond food and drink, every guest walks in with deeper needs:"
          },
          {
            "type": "heading",
            "content": "To Be Seen",
            "detail": ""
          },
          {
            "type": "list",
            "items": [
              "Acknowledged immediately",
              "Recognized as an individual, not a transaction",
              "Not invisible, not waiting"
            ]
          },
          {
            "type": "heading",
            "content": "To Be Heard",
            "detail": ""
          },
          {
            "type": "list",
            "items": [
              "Their preferences matter",
              "Their questions are welcome",
              "Their concerns are taken seriously"
            ]
          },
          {
            "type": "heading",
            "content": "To Be Valued",
            "detail": ""
          },
          {
            "type": "list",
            "items": [
              "They chose us over other options",
              "Their time and money are appreciated",
              "They're treated like family, not cattle"
            ]
          },
          {
            "type": "heading",
            "content": "The Insight",
            "detail": ""
          },
          {
            "type": "paragraph",
            "content": "\"When you understand what guests REALLY want, you stop worrying about scripts and start connecting as humans.\""
          }
        ]
      },
      {
        "heading": "The Emotional Journey of a Restaurant Visit (30 min)",
        "content": [
          {
            "type": "paragraph",
            "content": "Walk through the guest experience emotionally:"
          },
          {
            "type": "paragraph",
            "content": "**Arrival (Anticipation → First Impression)**"
          },
          {
            "type": "list",
            "items": [
              "Walking from car to door: \"Will this be good?\"",
              "First 5 seconds inside: \"Am I welcome here?\"",
              "This moment shapes everything that follows"
            ]
          },
          {
            "type": "paragraph",
            "content": "**Ordering (Uncertainty → Confidence)**"
          },
          {
            "type": "list",
            "items": [
              "Looking at menu: \"What should I get?\"",
              "Interacting with staff: \"Do they know what's good?\"",
              "Making a choice: \"Did I choose right?\""
            ]
          },
          {
            "type": "paragraph",
            "content": "**Waiting (Patience → Anxiety)**"
          },
          {
            "type": "list",
            "items": [
              "First few minutes: Fine",
              "Beyond expected time: \"Did they forget me?\"",
              "Any acknowledgment helps: \"Your food is coming right up\""
            ]
          },
          {
            "type": "paragraph",
            "content": "**Eating (Expectation → Reality)**"
          },
          {
            "type": "list",
            "items": [
              "First bite: Does it match expectation?",
              "Throughout meal: Am I being cared for?",
              "Problems arise: How are they handled?"
            ]
          },
          {
            "type": "paragraph",
            "content": "**Leaving (Reflection → Memory)**"
          },
          {
            "type": "list",
            "items": [
              "Paying: Friction or ease?",
              "Final interaction: Do they want me back?",
              "Walking out: What do I remember?"
            ]
          },
          {
            "type": "heading",
            "content": "The Insight",
            "detail": ""
          },
          {
            "type": "paragraph",
            "content": "\"You're not just serving food—you're guiding people through an emotional experience. Every touchpoint either builds or breaks the feeling.\""
          }
        ]
      },
      {
        "heading": "The Five-Second Window (20 min)",
        "content": [
          {
            "type": "heading",
            "content": "The Science",
            "detail": ""
          },
          {
            "type": "list",
            "items": [
              "First impressions form in 3-5 seconds",
              "They're nearly impossible to change",
              "Everything after is filtered through that first moment"
            ]
          },
          {
            "type": "heading",
            "content": "At Jayna",
            "detail": ""
          },
          {
            "type": "list",
            "items": [
              "Within 5 seconds of entry: acknowledged",
              "Eye contact made",
              "Warm, audible greeting"
            ]
          },
          {
            "type": "heading",
            "content": "What Happens Without It",
            "detail": ""
          },
          {
            "type": "paragraph",
            "content": "Guest's inner monologue:"
          },
          {
            "type": "list",
            "items": [
              "\"Is anyone working here?\"",
              "\"Am I supposed to seat myself?\"",
              "\"Maybe I should just leave...\""
            ]
          },
          {
            "type": "heading",
            "content": "What Happens With It",
            "detail": ""
          },
          {
            "type": "paragraph",
            "content": "Guest's inner monologue:"
          },
          {
            "type": "list",
            "items": [
              "\"Oh good, they see me\"",
              "\"This feels welcoming\"",
              "\"I'm in good hands\""
            ]
          },
          {
            "type": "heading",
            "content": "The Practice",
            "detail": ""
          },
          {
            "type": "paragraph",
            "content": "The greeting is EVERYONE'S job. Doesn't matter if you're at the bar, clearing a table, or walking to the bathroom. SEE the guest. GREET the guest."
          }
        ]
      },
      {
        "heading": "Service vs. Hospitality (20 min)",
        "content": [
          {
            "type": "heading",
            "content": "Service is transactional",
            "detail": ""
          },
          {
            "type": "list",
            "items": [
              "Take order",
              "Deliver food",
              "Process payment",
              "Done"
            ]
          },
          {
            "type": "heading",
            "content": "Hospitality is relational",
            "detail": ""
          },
          {
            "type": "list",
            "items": [
              "Make connection",
              "Anticipate needs",
              "Create moments",
              "Build relationship"
            ]
          },
          {
            "type": "heading",
            "content": "Service asks",
            "detail": "\"What does this person need?\""
          },
          {
            "type": "heading",
            "content": "Hospitality asks",
            "detail": "\"How can I make this person feel?\""
          },
          {
            "type": "heading",
            "content": "The Difference in Action",
            "detail": ""
          },
          {
            "type": "paragraph",
            "content": "| Service | Hospitality | |---------|-------------| | \"Here's your food\" | \"Here's your gyro—the lamb is especially good today. Enjoy!\" | | Refill water when asked | Refill water before they notice it's low | | Answer menu questions | Offer recommendations based on their preferences | | Fix mistakes | Fix mistakes AND add a gesture to make up for it |"
          }
        ]
      },
      {
        "heading": "\"Canceling Awkwardness\" (15 min)",
        "content": [
          {
            "type": "paragraph",
            "content": "Every moment of confusion or uncertainty is awkward for the guest. Our job is to CANCEL that awkwardness before it compounds."
          },
          {
            "type": "heading",
            "content": "Awkward Moments We Cancel",
            "detail": ""
          },
          {
            "type": "paragraph",
            "content": "| Awkward Situation | How We Cancel It | |-------------------|------------------| | Guest walks in, unsure where to go | Immediate greeting with clear direction | | Guest can't pronounce \"gyro\" | Say it naturally, no correction, no condescension | | Guest is deciding and feels rushed | \"Take your time—I'm here when you're ready\" | | Guest struggles to eat pita wrap | Offer fork without being asked | | Guest looks confused after ordering | \"You can grab a table anywhere—we'll bring it out\" | | Guest's food is taking longer | Proactive update: \"Just a couple more minutes\" |"
          },
          {
            "type": "heading",
            "content": "The Mindset",
            "detail": ""
          },
          {
            "type": "paragraph",
            "content": "Anticipate what might feel awkward. Remove it before they feel it."
          }
        ]
      }
    ],
    "activities": [
      {
        "title": "Guest Entry Observation (30 min)",
        "content": [
          {
            "type": "paragraph",
            "content": "During service, Heming observes 10 guests entering:"
          },
          {
            "type": "list",
            "items": [
              "Were they greeted within 5 seconds?",
              "Who greeted them?",
              "What was the guest's energy before and after greeting?",
              "Rate each greeting (1-5)"
            ]
          },
          {
            "type": "paragraph",
            "content": "Document observations for debrief."
          }
        ]
      },
      {
        "title": "Greeting Practice (20 min)",
        "content": [
          {
            "type": "paragraph",
            "content": "Role-play guest arrivals:"
          },
          {
            "type": "heading",
            "content": "Scenario 1",
            "detail": "Confident group of friends, excited energy"
          },
          {
            "type": "heading",
            "content": "Scenario 2",
            "detail": "Solo diner, looking at phone, quiet"
          },
          {
            "type": "heading",
            "content": "Scenario 3",
            "detail": "Family with kids, slightly overwhelmed"
          },
          {
            "type": "heading",
            "content": "Scenario 4",
            "detail": "Couple on a date, looking around curiously"
          },
          {
            "type": "heading",
            "content": "Scenario 5",
            "detail": "Regular who comes every week"
          },
          {
            "type": "heading",
            "content": "Scenario 6",
            "detail": "Person who looks frustrated before even entering"
          },
          {
            "type": "paragraph",
            "content": "For each: Practice the greeting. Adjust energy to match/complement."
          }
        ]
      },
      {
        "title": "Awkwardness Anticipation (15 min)",
        "content": [
          {
            "type": "paragraph",
            "content": "Walk through the restaurant and identify:"
          },
          {
            "type": "list",
            "items": [
              "5 moments where a guest might feel awkward",
              "How we currently cancel (or don't cancel) each",
              "One improvement for each"
            ]
          }
        ]
      }
    ],
    "fullMarkdown": "# UNIT 3.1: THE PSYCHOLOGY OF HOSPITALITY\n\n**Duration:** 2-3 hours  \n**Trainer:** Demetri  \n**Location:** Dining room + office discussion\n\n## Purpose\n\nBefore learning techniques, Heming must understand the psychology of WHY hospitality works. This is the foundation that makes everything else meaningful.\n\n## Content to Cover\n\n### What Guests Really Want (30 min)\n\nBeyond food and drink, every guest walks in with deeper needs:\n\n**To Be Seen:**\n- Acknowledged immediately\n- Recognized as an individual, not a transaction\n- Not invisible, not waiting\n\n**To Be Heard:**\n- Their preferences matter\n- Their questions are welcome\n- Their concerns are taken seriously\n\n**To Be Valued:**\n- They chose us over other options\n- Their time and money are appreciated\n- They're treated like family, not cattle\n\n**The Insight:**\n\"When you understand what guests REALLY want, you stop worrying about scripts and start connecting as humans.\"\n\n### The Emotional Journey of a Restaurant Visit (30 min)\n\nWalk through the guest experience emotionally:\n\n**Arrival (Anticipation → First Impression)**\n- Walking from car to door: \"Will this be good?\"\n- First 5 seconds inside: \"Am I welcome here?\"\n- This moment shapes everything that follows\n\n**Ordering (Uncertainty → Confidence)**\n- Looking at menu: \"What should I get?\"\n- Interacting with staff: \"Do they know what's good?\"\n- Making a choice: \"Did I choose right?\"\n\n**Waiting (Patience → Anxiety)**\n- First few minutes: Fine\n- Beyond expected time: \"Did they forget me?\"\n- Any acknowledgment helps: \"Your food is coming right up\"\n\n**Eating (Expectation → Reality)**\n- First bite: Does it match expectation?\n- Throughout meal: Am I being cared for?\n- Problems arise: How are they handled?\n\n**Leaving (Reflection → Memory)**\n- Paying: Friction or ease?\n- Final interaction: Do they want me back?\n- Walking out: What do I remember?\n\n**The Insight:**\n\"You're not just serving food—you're guiding people through an emotional experience. Every touchpoint either builds or breaks the feeling.\"\n\n### The Five-Second Window (20 min)\n\n**The Science:**\n- First impressions form in 3-5 seconds\n- They're nearly impossible to change\n- Everything after is filtered through that first moment\n\n**At Jayna:**\n- Within 5 seconds of entry: acknowledged\n- Eye contact made\n- Warm, audible greeting\n\n**What Happens Without It:**\nGuest's inner monologue:\n- \"Is anyone working here?\"\n- \"Am I supposed to seat myself?\"\n- \"Maybe I should just leave...\"\n\n**What Happens With It:**\nGuest's inner monologue:\n- \"Oh good, they see me\"\n- \"This feels welcoming\"\n- \"I'm in good hands\"\n\n**The Practice:**\nThe greeting is EVERYONE'S job. Doesn't matter if you're at the bar, clearing a table, or walking to the bathroom. SEE the guest. GREET the guest.\n\n### Service vs. Hospitality (20 min)\n\n**Service is transactional:**\n- Take order\n- Deliver food\n- Process payment\n- Done\n\n**Hospitality is relational:**\n- Make connection\n- Anticipate needs\n- Create moments\n- Build relationship\n\n**Service asks:** \"What does this person need?\"\n**Hospitality asks:** \"How can I make this person feel?\"\n\n**The Difference in Action:**\n\n| Service | Hospitality |\n|---------|-------------|\n| \"Here's your food\" | \"Here's your gyro—the lamb is especially good today. Enjoy!\" |\n| Refill water when asked | Refill water before they notice it's low |\n| Answer menu questions | Offer recommendations based on their preferences |\n| Fix mistakes | Fix mistakes AND add a gesture to make up for it |\n\n### \"Canceling Awkwardness\" (15 min)\n\nEvery moment of confusion or uncertainty is awkward for the guest. Our job is to CANCEL that awkwardness before it compounds.\n\n**Awkward Moments We Cancel:**\n\n| Awkward Situation | How We Cancel It |\n|-------------------|------------------|\n| Guest walks in, unsure where to go | Immediate greeting with clear direction |\n| Guest can't pronounce \"gyro\" | Say it naturally, no correction, no condescension |\n| Guest is deciding and feels rushed | \"Take your time—I'm here when you're ready\" |\n| Guest struggles to eat pita wrap | Offer fork without being asked |\n| Guest looks confused after ordering | \"You can grab a table anywhere—we'll bring it out\" |\n| Guest's food is taking longer | Proactive update: \"Just a couple more minutes\" |\n\n**The Mindset:**\nAnticipate what might feel awkward. Remove it before they feel it.\n\n## Hands-On Activities\n\n### Activity 1: Guest Entry Observation (30 min)\n\nDuring service, Heming observes 10 guests entering:\n- Were they greeted within 5 seconds?\n- Who greeted them?\n- What was the guest's energy before and after greeting?\n- Rate each greeting (1-5)\n\nDocument observations for debrief.\n\n### Activity 2: Greeting Practice (20 min)\n\nRole-play guest arrivals:\n\n**Scenario 1:** Confident group of friends, excited energy  \n**Scenario 2:** Solo diner, looking at phone, quiet  \n**Scenario 3:** Family with kids, slightly overwhelmed  \n**Scenario 4:** Couple on a date, looking around curiously  \n**Scenario 5:** Regular who comes every week  \n**Scenario 6:** Person who looks frustrated before even entering  \n\nFor each: Practice the greeting. Adjust energy to match/complement.\n\n### Activity 3: Awkwardness Anticipation (15 min)\n\nWalk through the restaurant and identify:\n- 5 moments where a guest might feel awkward\n- How we currently cancel (or don't cancel) each\n- One improvement for each\n\n## Reflection Questions\n\n1. The difference between service and hospitality is...\n2. When a guest walks in looking overwhelmed, I should...\n3. When a guest walks in with celebration energy, I should...\n4. The first 5 seconds matter because...\n5. One awkward moment I want to get better at canceling is...\n\n---\n",
    "reflection": [
      "The difference between service and hospitality is",
      "The three things guests really want (beyond food) are",
      "When a guest walks in looking overwhelmed, I should",
      "When a guest walks in with celebration energy, I should",
      "The first 5 seconds matter because",
      "\"Canceling awkwardness\" means",
      "Three awkward moments I can cancel at Jayna",
      "During my guest entry observation, I rated greetings. My observations"
    ]
  }
}