{
  "success": true,
  "unit": {
    "title": "CATERING OPERATIONS",
    "duration": "3-4 hours",
    "trainer": "Demetri",
    "location": "Office + Kitchen coordination",
    "purpose": "Catering is high-stakes hospitality. Heming needs to handle inquiries, coordinate execution, and ensure flawless delivery.",
    "contentSections": [
      {
        "heading": "SOP: Catering Review (30 min)",
        "content": [
          {
            "type": "heading",
            "content": "The Mindset",
            "detail": ""
          },
          {
            "type": "paragraph",
            "content": "\"Catering is high-touch, high-stakes hospitality. Each order represents our brand outside our walls.\""
          }
        ]
      },
      {
        "heading": "Inquiry Intake (45 min)",
        "content": [
          {
            "type": "heading",
            "content": "Response Time",
            "detail": ""
          },
          {
            "type": "list",
            "items": [
              "Within 1 hour if during business hours",
              "Same day maximum",
              "Quick response = professionalism"
            ]
          },
          {
            "type": "heading",
            "content": "Questions to Ask",
            "detail": ""
          },
          {
            "type": "paragraph",
            "content": "| Question | Why | |----------|-----| | Contact name and best number? | Follow-up and day-of communication | | Company/organization? | Context and personalization | | Event date and time? | Availability check | | Pickup or delivery? | Logistics and pricing | | Delivery address? | Delivery fee calculation | | Number of guests? | Quantity and pricing | | Any dietary restrictions? | Menu customization | | Budget range? | Appropriate recommendations | | What's the occasion? | Personalization opportunity |"
          },
          {
            "type": "heading",
            "content": "Making Recommendations",
            "detail": ""
          },
          {
            "type": "paragraph",
            "content": "Based on guest count:"
          },
          {
            "type": "list",
            "items": [
              "10-15: Individual boxes or BYO bar",
              "20-30: Family style platters",
              "30+: Combination, multiple platters"
            ]
          },
          {
            "type": "heading",
            "content": "Never Promise on the Spot",
            "detail": ""
          },
          {
            "type": "list",
            "items": [
              "\"Let me check availability and get back to you within [timeframe]\"",
              "Don't overcommit without checking with kitchen"
            ]
          }
        ]
      },
      {
        "heading": "Pricing and Finalization (30 min)",
        "content": [
          {
            "type": "heading",
            "content": "Using the Catering Menu",
            "detail": ""
          },
          {
            "type": "list",
            "items": [
              "Know the packages",
              "Understand per-person pricing",
              "Delivery fees by zone"
            ]
          },
          {
            "type": "heading",
            "content": "Tax",
            "detail": ""
          },
          {
            "type": "list",
            "items": [
              "California sales tax: 8.75% (Sacramento)",
              "Applied to food total"
            ]
          },
          {
            "type": "heading",
            "content": "Deposit",
            "detail": ""
          },
          {
            "type": "list",
            "items": [
              "Required for large orders (typically 50%)",
              "Confirm with Demetri on policy"
            ]
          },
          {
            "type": "heading",
            "content": "Demetri Approval Required",
            "detail": ""
          },
          {
            "type": "list",
            "items": [
              "Orders over $1000",
              "Unusual requests",
              "Discounts or special pricing"
            ]
          }
        ]
      },
      {
        "heading": "Confirmation Process (20 min)",
        "content": [
          {
            "type": "heading",
            "content": "Written Confirmation (Email)",
            "detail": ""
          },
          {
            "type": "list",
            "items": [
              "Everything in writing",
              "Date, time, location",
              "Exact items and quantities",
              "Total price including tax and delivery",
              "Payment terms",
              "Contact for day-of"
            ]
          },
          {
            "type": "heading",
            "content": "Internal Communication",
            "detail": ""
          },
          {
            "type": "list",
            "items": [
              "Kitchen Manager notified immediately",
              "Order posted on board 24-48 hours prior",
              "Shift lead aware of pickup/delivery time"
            ]
          },
          {
            "type": "heading",
            "content": "Day-Before Confirmation",
            "detail": ""
          },
          {
            "type": "list",
            "items": [
              "Call or email client to confirm",
              "Any last-minute changes",
              "Confirm pickup time or delivery address"
            ]
          }
        ]
      },
      {
        "heading": "Execution Day (30 min)",
        "content": [
          {
            "type": "heading",
            "content": "BOH Coordination",
            "detail": ""
          },
          {
            "type": "list",
            "items": [
              "Confirm order is on track",
              "Quality check items as they're prepared",
              "Labeling: all containers labeled with contents",
              "Allergies clearly marked",
              "Temperature: hot food hot, cold food cold"
            ]
          },
          {
            "type": "heading",
            "content": "Quality Check",
            "detail": ""
          },
          {
            "type": "paragraph",
            "content": "Before it leaves:"
          },
          {
            "type": "list",
            "items": [
              "All items accounted for",
              "Correct quantities",
              "Proper packaging (won't spill, leak)",
              "Utensils, napkins, plates included",
              "Labeling complete"
            ]
          },
          {
            "type": "heading",
            "content": "Pickup Execution",
            "detail": ""
          },
          {
            "type": "list",
            "items": [
              "Order staged and ready before arrival time",
              "Greet client by name",
              "Walk through the order",
              "Thank them warmly"
            ]
          },
          {
            "type": "heading",
            "content": "Delivery Execution",
            "detail": ""
          },
          {
            "type": "list",
            "items": [
              "Leave 15 minutes early minimum",
              "Photo documentation of setup",
              "Offer setup assistance",
              "Leave contact number for issues",
              "Thank them warmly"
            ]
          },
          {
            "type": "heading",
            "content": "Follow-Up",
            "detail": ""
          },
          {
            "type": "list",
            "items": [
              "Day after: Quick email or call",
              "\"How did everything go?\"",
              "Ask for feedback",
              "Invite future orders"
            ]
          }
        ]
      }
    ],
    "activities": [
      {
        "title": "Take a Practice Inquiry",
        "content": [
          {
            "type": "paragraph",
            "content": "Demetri role-plays as catering client:"
          },
          {
            "type": "list",
            "items": [
              "Practice intake questions",
              "Make recommendations",
              "Promise follow-up"
            ]
          }
        ]
      },
      {
        "title": "Complete a Catering Order Form",
        "content": [
          {
            "type": "paragraph",
            "content": "From the practice inquiry:"
          },
          {
            "type": "list",
            "items": [
              "Complete all fields",
              "Calculate pricing with tax",
              "Draft confirmation email"
            ]
          }
        ]
      },
      {
        "title": "Walk Through Execution (If available)",
        "content": [
          {
            "type": "paragraph",
            "content": "During actual catering order:"
          },
          {
            "type": "list",
            "items": [
              "Observe BOH coordination",
              "Participate in quality check",
              "Help with handoff"
            ]
          }
        ]
      }
    ],
    "fullMarkdown": "# UNIT 5.4: CATERING OPERATIONS\n\n**Duration:** 3-4 hours  \n**Trainer:** Demetri  \n**Location:** Office + Kitchen coordination\n\n## Purpose\n\nCatering is high-stakes hospitality. Heming needs to handle inquiries, coordinate execution, and ensure flawless delivery.\n\n## Content to Cover\n\n### SOP: Catering Review (30 min)\n\n**The Mindset:**\n\"Catering is high-touch, high-stakes hospitality. Each order represents our brand outside our walls.\"\n\n### Inquiry Intake (45 min)\n\n**Response Time:**\n- Within 1 hour if during business hours\n- Same day maximum\n- Quick response = professionalism\n\n**Questions to Ask:**\n\n| Question | Why |\n|----------|-----|\n| Contact name and best number? | Follow-up and day-of communication |\n| Company/organization? | Context and personalization |\n| Event date and time? | Availability check |\n| Pickup or delivery? | Logistics and pricing |\n| Delivery address? | Delivery fee calculation |\n| Number of guests? | Quantity and pricing |\n| Any dietary restrictions? | Menu customization |\n| Budget range? | Appropriate recommendations |\n| What's the occasion? | Personalization opportunity |\n\n**Making Recommendations:**\n\nBased on guest count:\n- 10-15: Individual boxes or BYO bar\n- 20-30: Family style platters\n- 30+: Combination, multiple platters\n\n**Never Promise on the Spot:**\n- \"Let me check availability and get back to you within [timeframe]\"\n- Don't overcommit without checking with kitchen\n\n### Pricing and Finalization (30 min)\n\n**Using the Catering Menu:**\n- Know the packages\n- Understand per-person pricing\n- Delivery fees by zone\n\n**Tax:**\n- California sales tax: 8.75% (Sacramento)\n- Applied to food total\n\n**Deposit:**\n- Required for large orders (typically 50%)\n- Confirm with Demetri on policy\n\n**Demetri Approval Required:**\n- Orders over $1000\n- Unusual requests\n- Discounts or special pricing\n\n### Confirmation Process (20 min)\n\n**Written Confirmation (Email):**\n- Everything in writing\n- Date, time, location\n- Exact items and quantities\n- Total price including tax and delivery\n- Payment terms\n- Contact for day-of\n\n**Internal Communication:**\n- Kitchen Manager notified immediately\n- Order posted on board 24-48 hours prior\n- Shift lead aware of pickup/delivery time\n\n**Day-Before Confirmation:**\n- Call or email client to confirm\n- Any last-minute changes\n- Confirm pickup time or delivery address\n\n### Execution Day (30 min)\n\n**BOH Coordination:**\n- Confirm order is on track\n- Quality check items as they're prepared\n- Labeling: all containers labeled with contents\n- Allergies clearly marked\n- Temperature: hot food hot, cold food cold\n\n**Quality Check:**\nBefore it leaves:\n- All items accounted for\n- Correct quantities\n- Proper packaging (won't spill, leak)\n- Utensils, napkins, plates included\n- Labeling complete\n\n**Pickup Execution:**\n- Order staged and ready before arrival time\n- Greet client by name\n- Walk through the order\n- Thank them warmly\n\n**Delivery Execution:**\n- Leave 15 minutes early minimum\n- Photo documentation of setup\n- Offer setup assistance\n- Leave contact number for issues\n- Thank them warmly\n\n**Follow-Up:**\n- Day after: Quick email or call\n- \"How did everything go?\"\n- Ask for feedback\n- Invite future orders\n\n## Hands-On Activities\n\n### Activity 1: Take a Practice Inquiry\n\nDemetri role-plays as catering client:\n- Practice intake questions\n- Make recommendations\n- Promise follow-up\n\n### Activity 2: Complete a Catering Order Form\n\nFrom the practice inquiry:\n- Complete all fields\n- Calculate pricing with tax\n- Draft confirmation email\n\n### Activity 3: Walk Through Execution (If available)\n\nDuring actual catering order:\n- Observe BOH coordination\n- Participate in quality check\n- Help with handoff\n\n## Reflection Questions\n\n1. When taking a catering inquiry, I should always ask...\n2. For a group of 20, I would recommend...\n3. I need Demetri's approval when...\n4. On execution day, I check for...\n5. The follow-up call should happen ___ and include...\n\n---\n",
    "reflection": [
      "When taking a catering inquiry, I should always ask",
      "For a group of 20, I would recommend",
      "I need Demetri's approval when",
      "On execution day, I check for",
      "The follow-up should include"
    ]
  }
}