{
  "success": true,
  "unit": {
    "title": "MEET THE TEAM — FOH",
    "duration": "2-3 hours (can be spread across first few shifts)",
    "trainer": "Demetri + Team Introductions",
    "location": "Throughout FOH",
    "purpose": "Heming needs to know her team before she can lead them. This isn't just learning names—it's beginning to build relationships and understanding each person's role and strengths.",
    "contentSections": [
      {
        "heading": "FOH Organizational Structure (15 min)",
        "content": [
          {
            "type": "paragraph",
            "content": "Before meeting individuals, explain the structure."
          },
          {
            "type": "heading",
            "content": "Positions",
            "detail": ""
          },
          {
            "type": "list",
            "items": [
              "Cashier/Order Taker: First guest contact, order accuracy, upselling",
              "Expo: Quality control, food delivery, communication hub",
              "Runner: Food delivery, table maintenance, support",
              "Bar: Beverage service, cocktails, guest experience",
              "Host (when applicable): Seating, reservations, first impression"
            ]
          },
          {
            "type": "heading",
            "content": "How They Work Together",
            "detail": ""
          },
          {
            "type": "list",
            "items": [
              "The flow from order to delivery",
              "Who communicates with whom",
              "The expo as the \"quarterback\" of FOH service"
            ]
          },
          {
            "type": "heading",
            "content": "Key People to Know",
            "detail": ""
          },
          {
            "type": "list",
            "items": [
              "Point out any shift leads or senior team members",
              "Who has been here longest",
              "Who to go to with questions when Demetri isn't available"
            ]
          }
        ]
      },
      {
        "heading": "Individual Introductions (60-90 min)",
        "content": [
          {
            "type": "paragraph",
            "content": "Introduce Heming to each FOH team member personally. This should feel genuine, not like a parade."
          },
          {
            "type": "heading",
            "content": "For Each Person, Cover",
            "detail": ""
          },
          {
            "type": "list",
            "items": [
              "Name and role",
              "How long they've been at Jayna",
              "One thing they do particularly well",
              "Something personal (if appropriate to share)"
            ]
          },
          {
            "type": "heading",
            "content": "Heming Should",
            "detail": ""
          },
          {
            "type": "list",
            "items": [
              "Shake hands or appropriate greeting",
              "Make eye contact",
              "Ask at least one question",
              "Take mental notes (written notes later)"
            ]
          },
          {
            "type": "heading",
            "content": "Facilitate Connection",
            "detail": ""
          },
          {
            "type": "paragraph",
            "content": "\"[Name], this is Heming, our new Assistant Manager. She's going to be shadowing everyone this week to learn how we operate. Heming, [Name] is incredible at [specific skill]—you should watch how they [specific thing].\""
          }
        ]
      },
      {
        "heading": "Shadowing Sessions (30 min each position)",
        "content": [
          {
            "type": "paragraph",
            "content": "Heming spends at least 30 minutes observing each FOH role during actual service."
          },
          {
            "type": "heading",
            "content": "Cashier/Order Taker Shadow",
            "detail": ""
          },
          {
            "type": "list",
            "items": [
              "Watch the greeting and order process",
              "Notice upselling techniques",
              "See how modifications are handled",
              "Observe payment processing"
            ]
          },
          {
            "type": "heading",
            "content": "Expo Shadow",
            "detail": ""
          },
          {
            "type": "list",
            "items": [
              "Watch quality control checks",
              "See the communication with kitchen",
              "Notice how tickets are managed",
              "Observe food delivery coordination"
            ]
          },
          {
            "type": "heading",
            "content": "Runner Shadow",
            "detail": ""
          },
          {
            "type": "list",
            "items": [
              "See table maintenance in action",
              "Watch food delivery technique",
              "Notice how they anticipate needs",
              "Observe the \"constant motion\" mindset"
            ]
          },
          {
            "type": "heading",
            "content": "Bar Shadow (Brief)",
            "detail": ""
          },
          {
            "type": "list",
            "items": [
              "Initial exposure (deep training in Module 4)",
              "See the setup and flow",
              "Notice guest interaction style",
              "Understand bar's role in overall service"
            ]
          },
          {
            "type": "heading",
            "content": "After Each Shadow",
            "detail": ""
          },
          {
            "type": "paragraph",
            "content": "Quick debrief with Heming:"
          },
          {
            "type": "list",
            "items": [
              "What did you notice?",
              "What did they do well?",
              "What questions do you have?",
              "What would you want to learn to do?"
            ]
          }
        ]
      }
    ],
    "activities": [
      {
        "title": "Team Roster Creation (Ongoing)",
        "content": [
          {
            "type": "paragraph",
            "content": "Heming creates a personal document with:"
          },
          {
            "type": "list",
            "items": [
              "Every FOH team member's name",
              "Their role",
              "How long at Jayna",
              "One personal detail she learned",
              "One professional strength she observed"
            ]
          },
          {
            "type": "paragraph",
            "content": "This becomes her reference for managing the team."
          }
        ]
      },
      {
        "title": "\"What I Learned\" Observations (After shadowing)",
        "content": [
          {
            "type": "paragraph",
            "content": "For each position shadowed, Heming writes:"
          },
          {
            "type": "list",
            "items": [
              "Three things this role is responsible for",
              "One thing that surprised her",
              "One thing she wants to learn more about"
            ]
          }
        ]
      }
    ],
    "fullMarkdown": "# UNIT 1.3: MEET THE TEAM — FOH\n\n**Duration:** 2-3 hours (can be spread across first few shifts)  \n**Trainer:** Demetri + Team Introductions  \n**Location:** Throughout FOH\n\n## Purpose\n\nHeming needs to know her team before she can lead them. This isn't just learning names—it's beginning to build relationships and understanding each person's role and strengths.\n\n## Content to Cover\n\n### FOH Organizational Structure (15 min)\n\nBefore meeting individuals, explain the structure.\n\n**Positions:**\n- Cashier/Order Taker: First guest contact, order accuracy, upselling\n- Expo: Quality control, food delivery, communication hub\n- Runner: Food delivery, table maintenance, support\n- Bar: Beverage service, cocktails, guest experience\n- Host (when applicable): Seating, reservations, first impression\n\n**How They Work Together:**\n- The flow from order to delivery\n- Who communicates with whom\n- The expo as the \"quarterback\" of FOH service\n\n**Key People to Know:**\n- Point out any shift leads or senior team members\n- Who has been here longest\n- Who to go to with questions when Demetri isn't available\n\n### Individual Introductions (60-90 min)\n\nIntroduce Heming to each FOH team member personally. This should feel genuine, not like a parade.\n\n**For Each Person, Cover:**\n- Name and role\n- How long they've been at Jayna\n- One thing they do particularly well\n- Something personal (if appropriate to share)\n\n**Heming Should:**\n- Shake hands or appropriate greeting\n- Make eye contact\n- Ask at least one question\n- Take mental notes (written notes later)\n\n**Facilitate Connection:**\n\"[Name], this is Heming, our new Assistant Manager. She's going to be shadowing everyone this week to learn how we operate. Heming, [Name] is incredible at [specific skill]—you should watch how they [specific thing].\"\n\n### Shadowing Sessions (30 min each position)\n\nHeming spends at least 30 minutes observing each FOH role during actual service.\n\n**Cashier/Order Taker Shadow:**\n- Watch the greeting and order process\n- Notice upselling techniques\n- See how modifications are handled\n- Observe payment processing\n\n**Expo Shadow:**\n- Watch quality control checks\n- See the communication with kitchen\n- Notice how tickets are managed\n- Observe food delivery coordination\n\n**Runner Shadow:**\n- See table maintenance in action\n- Watch food delivery technique\n- Notice how they anticipate needs\n- Observe the \"constant motion\" mindset\n\n**Bar Shadow (Brief):**\n- Initial exposure (deep training in Module 4)\n- See the setup and flow\n- Notice guest interaction style\n- Understand bar's role in overall service\n\n**After Each Shadow:**\nQuick debrief with Heming:\n- What did you notice?\n- What did they do well?\n- What questions do you have?\n- What would you want to learn to do?\n\n## Hands-On Activities\n\n### Activity 1: Team Roster Creation (Ongoing)\n\nHeming creates a personal document with:\n- Every FOH team member's name\n- Their role\n- How long at Jayna\n- One personal detail she learned\n- One professional strength she observed\n\nThis becomes her reference for managing the team.\n\n### Activity 2: \"What I Learned\" Observations (After shadowing)\n\nFor each position shadowed, Heming writes:\n- Three things this role is responsible for\n- One thing that surprised her\n- One thing she wants to learn more about\n\n## Trainer Notes\n\n**Tone for This Unit:**\nCollaborative and curious. Heming is learning, but she's also being introduced as a future leader. Team members should feel respected, not inspected.\n\n**Common Pitfalls:**\n- Introducing Heming as \"the new boss\" (she's learning alongside them)\n- Rushing through introductions without genuine connection\n- Skipping shadow time because \"she'll learn on the job\"\n- Not following up on what she observed\n\n**Tips for Success:**\n- Spread this over multiple shifts if needed\n- Let Heming shadow during actual service, not just prep\n- Encourage her to ask team members questions directly\n- Check in: \"Who have you not met yet?\"\n\n**End This Unit With:**\n\"You've met the FOH family. Tomorrow we'll do the same with BOH. The kitchen crew is the engine that makes everything possible—let's make sure they know you respect that.\"\n\n---\n",
    "reflection": [
      "The FOH team member I learned the most from today was _______________ because",
      "One thing that surprised me about how this team works together",
      "After shadowing the Cashier/Order Taker position, I learned",
      "After shadowing the Expo position, I learned",
      "After shadowing the Runner position, I learned",
      "After shadowing the Bar briefly, I noticed",
      "The FOH position I'm most curious to learn more about is _______________ because",
      "Questions I have about FOH operations"
    ]
  }
}